{
  "crosswalk_version": "1.0.0",
  "generated_for": "harness",
  "do_not_auto_refresh": true,
  "governance": {
    "rule": "This artifact is human-curated and LIVE-VERIFIED. Do NOT auto-refresh, auto-regenerate, or let any model rewrite mappings without explicit human review. Taxonomy IDs (esp. OWASP Top 10:2025 ordering) are pinned and must not be silently 'updated' from model memory.",
    "verified_on": "2026-06-05",
    "seeds": "~/.claude/skills/appsec-security-orchestrator/references/standards-crosswalk.json"
  },
  "standards": {
    "owasp_top10_2025": {
      "id": "owasp_top10_2025",
      "name": "OWASP Top 10",
      "version": "2025",
      "source": "https://owasp.org/Top10/",
      "verified_on": "2026-06-05",
      "items": [
        { "id": "A01", "title": "Broken Access Control" },
        { "id": "A02", "title": "Security Misconfiguration" },
        { "id": "A03", "title": "Software Supply Chain Failures" },
        { "id": "A04", "title": "Cryptographic Failures" },
        { "id": "A05", "title": "Injection" },
        { "id": "A06", "title": "Insecure Design" },
        { "id": "A07", "title": "Authentication Failures" },
        { "id": "A08", "title": "Software or Data Integrity Failures" },
        { "id": "A09", "title": "Security Logging and Alerting Failures" },
        { "id": "A10", "title": "Mishandling of Exceptional Conditions" }
      ]
    },
    "owasp_asvs_5_0": {
      "id": "owasp_asvs_5_0",
      "name": "OWASP Application Security Verification Standard",
      "version": "5.0",
      "source": "https://owasp.org/www-project-application-security-verification-standard/",
      "verified_on": "2026-06-05",
      "items": [
        { "id": "V1", "title": "Encoding and Sanitization" },
        { "id": "V2", "title": "Validation and Business Logic" },
        { "id": "V3", "title": "Web Frontend Security" },
        { "id": "V4", "title": "API and Web Service" },
        { "id": "V5", "title": "File Handling" },
        { "id": "V6", "title": "Authentication" },
        { "id": "V7", "title": "Session Management" },
        { "id": "V8", "title": "Authorization" },
        { "id": "V9", "title": "Self-contained Tokens" },
        { "id": "V10", "title": "OAuth and OIDC" },
        { "id": "V11", "title": "Cryptography" },
        { "id": "V12", "title": "Secure Communication" },
        { "id": "V13", "title": "Configuration" },
        { "id": "V14", "title": "Data Protection" },
        { "id": "V15", "title": "Secure Coding and Architecture" },
        { "id": "V16", "title": "Security Logging and Error Handling" },
        { "id": "V17", "title": "WebRTC" }
      ]
    },
    "owasp_llm_top10_2025": {
      "id": "owasp_llm_top10_2025",
      "name": "OWASP Top 10 for LLM Applications",
      "version": "2025",
      "source": "https://genai.owasp.org/llm-top-10/",
      "verified_on": "2026-06-05",
      "items": [
        { "id": "LLM01", "title": "Prompt Injection" },
        { "id": "LLM02", "title": "Sensitive Information Disclosure" },
        { "id": "LLM03", "title": "Supply Chain" },
        { "id": "LLM04", "title": "Data and Model Poisoning" },
        { "id": "LLM05", "title": "Improper Output Handling" },
        { "id": "LLM06", "title": "Excessive Agency" },
        { "id": "LLM07", "title": "System Prompt Leakage" },
        { "id": "LLM08", "title": "Vector and Embedding Weaknesses" },
        { "id": "LLM09", "title": "Misinformation" },
        { "id": "LLM10", "title": "Unbounded Consumption" }
      ]
    },
    "owasp_agentic_asi_2025": {
      "id": "owasp_agentic_asi_2025",
      "name": "OWASP Agentic Security Initiative Top 10",
      "version": "2025-12-09",
      "source": "https://genai.owasp.org/initiatives/#agenticsecurity",
      "verified_on": "2026-06-05",
      "items": [
        { "id": "ASI01", "title": "Agent Goal Hijack" },
        { "id": "ASI02", "title": "Tool Misuse" },
        { "id": "ASI03", "title": "Identity & Privilege Abuse" },
        { "id": "ASI04", "title": "Agentic Supply Chain Vulnerabilities" },
        { "id": "ASI05", "title": "Unexpected Code Execution" },
        { "id": "ASI06", "title": "Memory & Context Poisoning" },
        { "id": "ASI07", "title": "Insecure Inter-Agent Communication" },
        { "id": "ASI08", "title": "Cascading Failures" },
        { "id": "ASI09", "title": "Human-Agent Trust Exploitation" },
        { "id": "ASI10", "title": "Rogue Agents" }
      ]
    },
    "nist_csf_2_0": {
      "id": "nist_csf_2_0",
      "name": "NIST Cybersecurity Framework",
      "version": "2.0",
      "source": "https://www.nist.gov/cyberframework",
      "verified_on": "2026-06-05",
      "items": [
        { "id": "GV", "title": "Govern" },
        { "id": "ID", "title": "Identify" },
        { "id": "PR", "title": "Protect" },
        { "id": "DE", "title": "Detect" },
        { "id": "RS", "title": "Respond" },
        { "id": "RC", "title": "Recover" }
      ]
    },
    "nist_ssdf_800_218": {
      "id": "nist_ssdf_800_218",
      "name": "NIST Secure Software Development Framework",
      "version": "SP 800-218",
      "source": "https://csrc.nist.gov/pubs/sp/800/218/final",
      "verified_on": "2026-06-05",
      "items": [
        { "id": "PO", "title": "Prepare the Organization" },
        { "id": "PS", "title": "Protect the Software" },
        { "id": "PW", "title": "Produce Well-Secured Software" },
        { "id": "RV", "title": "Respond to Vulnerabilities" }
      ]
    },
    "iso_iec_25010_2023": {
      "id": "iso_iec_25010_2023",
      "name": "ISO/IEC 25010 Product Quality Model",
      "version": "2023",
      "source": "https://www.iso.org/standard/78176.html",
      "verified_on": "2026-06-05",
      "items": [
        { "id": "FunctionalSuitability", "title": "Functional Suitability" },
        { "id": "PerformanceEfficiency", "title": "Performance Efficiency" },
        { "id": "Compatibility", "title": "Compatibility" },
        { "id": "InteractionCapability", "title": "Interaction Capability" },
        { "id": "Reliability", "title": "Reliability" },
        { "id": "Security", "title": "Security" },
        { "id": "Maintainability", "title": "Maintainability" },
        { "id": "Flexibility", "title": "Flexibility" },
        { "id": "Safety", "title": "Safety" }
      ]
    },
    "wcag_2_2": {
      "id": "wcag_2_2",
      "name": "Web Content Accessibility Guidelines",
      "version": "2.2",
      "source": "https://www.w3.org/TR/WCAG22/",
      "verified_on": "2026-06-05",
      "items": [
        { "id": "Perceivable", "title": "Perceivable (Principle 1)" },
        { "id": "Operable", "title": "Operable (Principle 2)" },
        { "id": "Understandable", "title": "Understandable (Principle 3)" },
        { "id": "Robust", "title": "Robust (Principle 4)" }
      ]
    },
    "core_web_vitals": {
      "id": "core_web_vitals",
      "name": "Core Web Vitals",
      "version": "2024+",
      "source": "https://web.dev/articles/vitals",
      "verified_on": "2026-06-05",
      "items": [
        { "id": "LCP", "title": "Largest Contentful Paint" },
        { "id": "INP", "title": "Interaction to Next Paint" },
        { "id": "CLS", "title": "Cumulative Layout Shift" }
      ]
    }
  },
  "crosswalk": [
    {
      "id": "CW-001-access-control",
      "links": {
        "asvs": "V8",
        "owasp_top10_2025": "A01",
        "owasp_asi": "ASI03",
        "cwe_family": "CWE-284",
        "csf": "PR",
        "ssdf": "PW",
        "iso25010": "Security"
      },
      "confidence": "high",
      "note": "Authorization / broken access control. ASVS V8 verifies it, Top10:2025 A01 names it, ASI03 is the agentic identity/privilege-abuse analogue, CWE-284 (Improper Access Control) is the weakness family, CSF PR is the protect function, SSDF PW is produce-well-secured, ISO Security is the quality characteristic.",
      "source": "https://owasp.org/Top10/A01_2025-Broken_Access_Control/",
      "verified_on": "2026-06-05"
    },
    {
      "id": "CW-002-misconfiguration",
      "links": {
        "asvs": "V13",
        "owasp_top10_2025": "A02",
        "cwe_family": "CWE-16",
        "csf": "PR",
        "ssdf": "PO",
        "iso25010": "Security"
      },
      "confidence": "high",
      "note": "Security misconfiguration maps to ASVS V13 Configuration and CWE-16 (Configuration). PO (Prepare the Organization) covers secure default config baselines.",
      "source": "https://owasp.org/Top10/A02_2025-Security_Misconfiguration/",
      "verified_on": "2026-06-05"
    },
    {
      "id": "CW-003-supply-chain",
      "links": {
        "owasp_top10_2025": "A03",
        "owasp_llm": "LLM03",
        "owasp_asi": "ASI04",
        "cwe_family": "CWE-1357",
        "csf": "ID",
        "ssdf": "PS",
        "iso25010": "Security"
      },
      "confidence": "high",
      "note": "A03:2025 = Software Supply Chain Failures (NEW in 2025; this is NOT Injection). Maps to LLM03 Supply Chain, ASI04 Agentic Supply Chain Vulnerabilities, CWE-1357 (Reliance on Insufficiently Trustworthy Component). SSDF PS (Protect the Software) and CSF ID (asset/dependency inventory) cover it. No single ASVS chapter is a clean 1:1; supply-chain touches V13/V15 indirectly so ASVS is intentionally omitted here.",
      "source": "https://owasp.org/Top10/A03_2025-Software_Supply_Chain_Failures/",
      "verified_on": "2026-06-05"
    },
    {
      "id": "CW-004-crypto-failures",
      "links": {
        "asvs": "V11",
        "owasp_top10_2025": "A04",
        "cwe_family": "CWE-310",
        "csf": "PR",
        "ssdf": "PW",
        "iso25010": "Security"
      },
      "confidence": "high",
      "note": "Cryptographic failures map to ASVS V11 Cryptography (and adjacent V12 Secure Communication for in-transit). CWE-310 (Cryptographic Issues) family.",
      "source": "https://owasp.org/Top10/A04_2025-Cryptographic_Failures/",
      "verified_on": "2026-06-05"
    },
    {